iri,label,type,status,definition
https://www.commoncoreontologies.org/ont00001801,is subject of,property,OK,"individual i 'is subject of' individual j iff individual j is an instance of 'Information Content Entity', where individual i is a carrier of information content and individual j is the information content that is being conveyed, and individual i is related to individual j."
https://www.commoncoreontologies.org/ont00001808,is about,property,OK,"individual i 'is about' individual j iff [individual i 'is about' individual j] and [individual i is an instance of 'Information Content Entity'] and [individual j is an instance of 'entity'], where individual i is a carrier of information content and individual j is the subject of that information content."
https://www.commoncoreontologies.org/ont00001811,is an ordinal measurement of,property,OK,"individual i 'is an ordinal measurement of' individual j iff [individual i 'is an ordinal measurement of' individual j] , where individual i is an instance of class 'Quantity' and individual j is an instance of class 'Physical Quantity'."
https://www.commoncoreontologies.org/ont00001824,is excerpted from,property,OK,"individual i 'is excerpted from' individual j iff individual i is an instance of 'Information Bearing Entity' and individual j is an instance of 'Information Bearing Entity', where individual i is a source of information for individual j."
https://www.commoncoreontologies.org/ont00001837,time zone identifier used by,property,OK,"individual i 'time zone identifier used by' individual j iff [individual i 'generically depends on' individual j] and [individual i is an instance of 'Time Zone Identifier'] and [individual j is an instance of 'Information Bearing Entity'], where 'time zone identifier used by' specifies input, while 'generally depends on' indicates conditional reliance."
https://www.commoncoreontologies.org/ont00001863,uses measurement unit,property,OK,individual i 'uses measurement unit' individual j iff [individual i 'is carrier of' individual j] and [individual i is an instance of 'Information Bearing Entity'] and [individual j is an instance of 'Measurement Unit'] and [individual i is an instance of 'Information Conveyance'] where [individual i is a carrier of individual j with respect to a 'Measurement Unit'] .
https://www.commoncoreontologies.org/ont00001868,is a nominal measurement of,property,OK,"individual i 'is a nominal measurement of' individual j iff [individual i 'is a measurement of' individual j] and [individual i is an instance of 'Nominal Measurement Information Content Entity'] , where individual i 'is a nominal measurement of' individual j 'represented by' a noun."
https://www.commoncoreontologies.org/ont00001873,represented by,property,OK,"individual i 'represented by' individual j iff [individual i 'is subject of' individual j] and [individual j is an instance of 'Representational Informaation Content entity'] and [individual i is an instance of 'Information Content Entity'] and [individual j is an instance of 'Information Content Entity'], where 'represented by' denotes authorship, while 'is subject of' indicates topic."
https://www.commoncoreontologies.org/ont00001877,is an interval measurement of,property,OK,"individual i 'is an interval measurement of' individual j iff [individual i is an is an interval measurement of individual j] , where individual i is an interval measurement of individual j with respect to the interval 'interval'."
https://www.commoncoreontologies.org/ont00001878,is mention of,property,OK,"individual i 'is mention of' individual j iff [individual i is a mention of individual j] , where individual i is a mention of individual j and individual j is an instance of class 'Mentioned entity'."
https://www.commoncoreontologies.org/ont00001879,designated by,property,OK,"individual i 'designated by' individual j iff [individual i 'is subject of' individual j] and [individual j is an instance of 'Designaive Information Content Entity'] and [individual i is a desiginator] and [individual j is a desiginated 'entity'], where [individual i 'designated by' individual j] indicates assignment."
https://www.commoncoreontologies.org/ont00001884,condition described by,property,OK,"individual i 'condition described by' individual j iff [individual i 'is subject of' individual j] and [individual i is an instance of class 'Topic'] and [individual j is an instance of class 'Information Content Entity'], where 'condition described by' indicates a topic, while 'is subject of' indicates agency."
https://www.commoncoreontologies.org/ont00001899,language used in,property,OK,"individual i 'language used in' individual j iff [individual i 'prescribes' individual j] and [individual i is an instance of 'Language'] and [individual j is an instance of 'Informaation Bearing entity'], where 'language used in' denotes context, while 'prescribes' indicates regulation."
https://www.commoncoreontologies.org/ont00001900,is geospatial coordinate reference system of,property,OK,"individual i 'is geospatial coordinate reference system of' individual j iff [individual i 'is 'reference system' of' individual j] and [individual i is an instance of 'Geospatial Coordinate Reference System'] and [individual j is an instance of 'Information Bearing Entity'], where 'is 'geospatial coordinate reference system' of' specifies spatial location, while 'is 'reference system' of' denotes a broader system of reference."
https://www.commoncoreontologies.org/ont00001904,is measured by,property,OK,"individual i 'is measured by' individual j iff [individual i 'is measured by' individual j] and [individual i is an instance of class 'Description Information Content Entity'] and [individual j is an instance of class 'Descriptive Information Content Entity'], where 'is measured by' denotes quantification, while 'described by' indicates characterization."
https://www.commoncoreontologies.org/ont00001908,uses time zone identifier,property,OK,"individual i 'uses time zone identifier' individual j iff [individual i 'is carrier of' individual j] and [individual i is an instance of 'InformaInformation Bearing entity'] and [individual j is an instance of 'Time Zone Identifier'] where [individual i 'uses time zone identifier' is a temporal context, and is d"
https://www.commoncoreontologies.org/ont00001912,uses reference system,property,OK,"individual i 'uses reference system' individual j iff [individual i 'is carrier of' individual j] and [individual i is an instance of 'Information Bearing Entity'] and [individual j is an instance of 'Reference System'], where 'uses reference system' denotes employing a framework for spatial positioning, while 'is carrier of' indicates conveying information."
https://www.commoncoreontologies.org/ont00001913,uses geospatial coordinate reference system,property,OK,"individual i 'uses geospatial coordinate reference system' individual j iff [individual i 'uses reference system' individual j] and [individual i is an instance of 'Information Bearing Entity'] and [individual j is an instance of 'Geospatial Coordinate Reference System'], where 'uses geospatial coordinate reference system' specifies geographic positioning, while 'uses reference system' is more general."
https://www.commoncoreontologies.org/ont00001914,is measured by nominal,property,OK,"individual i 'is measured by nominal' individual j iff [individual i 'is measured by' individual j] and [individual j is an instance of 'Nominal Measurement Information Content Entity'] and [individual i is a categorization of individual j] and [individual j is a 'Measurement Information Content Entity'], where [individual i is a categorization of individual j] and [individual j is a 'Measurement Information Content Entity'] d"
https://www.commoncoreontologies.org/ont00001916,designates,property,OK,"individual i 'designates' individual j iff [individual i 'is about' individual j] and [individual i is an instance of class 'Designaive Infoirmaation Content entity'] and [individual j is an instance of class 'entity'], where 'designates' indicates 'function', while 'is about' denotes topic."
https://www.commoncoreontologies.org/ont00001917,described by,property,OK,"individual i 'described by' individual j iff [individual i 'is subject of' individual j] and [individual j is an instance of 'Descriptive Information Content Entity'] and [individual i is an instance of 'Author'] and [individual j is an instance of 'Information Content Entity'], where 'described by' indicates authorship, while 'is subject of' denotes topic."
https://www.commoncoreontologies.org/ont00001919,is mentioned by,property,OK,"individual i 'is mentioned by' individual j iff [individual i is 'entity'] and [individual j is 'entity'], where individual i 'is mentioned by' individual j in the context of communication'."
https://www.commoncoreontologies.org/ont00001920,prescribed by,property,OK,"individual i 'prescribed by' individual j iff [individual i 'is subject of' individual j] and [individual j is an instance of 'Directive Information Content Entity'] and [individual i is an instance of 'Individual'] and [individual j is an instance of 'Information Content Entity'], where [individual i 'prescribed by' individual j] indicates mandated authority."
https://www.commoncoreontologies.org/ont00001938,represents,property,OK,"individual i 'represents' individual j iff [individual i 'is about' individual j] and [individual i is an instance of class 'Representational Informaation Content entity'] and [individual j is an instance of class 'entity'], where 'represents' denotes depiction, while 'is about' indicates thematic focus."
https://www.commoncoreontologies.org/ont00001942,prescribes,property,OK,"individual i 'prescribes' individual j iff [individual i 'is about' individual j] and [individual i is an instance of class 'Directive Informaation Content entity'] and [individual i 'prescribees' individual j] denotes mandated action, where individual j is an 'entity' that is the 'Target' of the mandated action."
https://www.commoncoreontologies.org/ont00001961,is measurement unit of,property,OK,"individual i 'is measurement unit of' individual j iff [individual i 'generically depends on' individual j] and [individual i is an instance of 'Measurement Unit'] and [individual j is an instance of 'Information Bearing Entity'], where individual i is a 'Measurement Unit' that is related to individual j in a way that indicates a quantitative relationship."
https://www.commoncoreontologies.org/ont00001963,is measured by ordinal,property,OK,"individual i 'is measured by ordinal' individual j iff [individual i 'is measured by' individual j] and [individual j is an instance of 'Ordinal Measurement Infoirmaation Content entity'] and [individual i is an instance of 'Ordinal Measurement Infoirmaation Content entity'] and [individual j is an instance of 'Measurement Infoirmaation Content entity'], where 'is measured by ordinal' denotes ranked assessment, while 'is measured by' indicates quantitative assessment."
https://www.commoncoreontologies.org/ont00001964,is measured by interval,property,OK,"individual i 'is measured by interval' individual j iff [individual i 'is measured by' individual j] and [individual j is an instance of 'Interval Measurement Infoirmaation Content entity'] and [individual i 'is measured by interval' individual j] denotes time-based measurement, where [individual i 'is measured by interval' individual j] d"
https://www.commoncoreontologies.org/ont00001965,is measured by ratio,property,OK,"individual i 'is measured by ratio' individual j iff [individual i 'is measured by' individual j] and [individual j is an instance of 'Ratio Measurement Infoirmaation Content entity'] and [individual i is proportional to individual j] , where [individual i 'is measured by' individual j is a direct quantitative assessment of the relationship between individual i and individual j] ."
https://www.commoncoreontologies.org/ont00001966,is a measurement of,property,OK,"individual i 'is a measurement of' individual j iff [individual i 'describes' individual j] and [individual i is an instance of 'Measurement Information Content Entity'] and [individual i 'is a measurement of' quantifies], where [individual i 'is a measurement of' individual j] d"
https://www.commoncoreontologies.org/ont00001976,uses language,property,OK,"individual i 'uses language' individual j iff [individual i 'prescribed by' individual j] and [individual i is an instance of 'Information Bearing Entity'] and [individual j is an instance of 'Language'] where [individual i 'uses language' individual j denotes the 'Act' of employing a specific 'Language', d"
https://www.commoncoreontologies.org/ont00001980,describes condition,property,OK,"individual i 'describes condition' individual j iff [individual i 'is about' individual j] and [individual i is an instance of class 'Information Content Entity'] and [individual j is an instance of class 'entity'], where 'describe condition' denotes state, and 'is about' denotes topic."
https://www.commoncoreontologies.org/ont00001982,describes,property,OK,"individual i 'describes' individual j iff [individual i 'is about' individual j] and [individual i is an instance of 'Descriptive Informaation Content entity'] and [individual j is an instance of 'entity'], where 'describes' conveys content, while 'is about' indicates topic."
https://www.commoncoreontologies.org/ont00001983,is a ratio measurement of,property,OK,"individual i 'is a ratio measurement of' individual j iff [individual i 'is a measurement of' individual j] and [individual i is an instance of 'Ratio Measurement Information Content Entity'] and [individual i 'is a ratio measurement of' individual j] indicates a scale with a true zero point, where [individual i 'is a measurement of' individual j] does not necessarily imply a true zero point."
https://www.commoncoreontologies.org/ont00001997,is reference system of,property,OK,"individual i 'is reference system of' individual j iff individual i 'generically depends on' individual j and individual i is an instance of 'Reference System' and individual j is an instance of 'Information Bearing Entity', where 'is 'reference system' of' denotes foundational dependence."
https://www.commoncoreontologies.org/ont00001765,has text value,property,OK,"individual i 'has text value' individual j iff individual i is an instance of 'Infoрмаtion Bearing entity', where individual i has a text value that is identical to the text value of individual j."
https://www.commoncoreontologies.org/ont00001767,has datetime value,property,OK,"individual i 'has datetime value' individual j iff [individual i 'has datetime value' individual j] and [individual i is an instance of 'InformaInformation Bearing entity'] , where individual i has a datetime value that is contained in individual j."
https://www.commoncoreontologies.org/ont00001768,has uri value,property,OK,"individual i 'has uri value' individual j iff [individual i 'has URI value' individual j] and [individual i is an instance of class 'Information Bearing Entity'], where individual i has a uri value that is the same as the uri value of individual j."
https://www.commoncoreontologies.org/ont00001769,has decimal value,property,OK,"individual i 'has decimal value' individual j iff [individual i 'has decimal value' individual j] and [individual i is an instance of class 'Information Bearing Entity'] , where individual i has a decimal value that is a part of individual j."
https://www.commoncoreontologies.org/ont00001770,has double value,property,OK,"individual i 'has double value' individual j iff [individual i 'has double value' individual j] and [individual i is an instance of class 'Information Bearing Entity'], where individual i has a value that is a subset of the value of individual j."
https://www.commoncoreontologies.org/ont00001771,has date value,property,OK,"individual i 'has date value' individual j iff [individual i 'has date value' individual j] and [individual i is an instance of class 'Information Bearing Entity'] , where individual i has a date value that is the same as the date value of individual j."
https://www.commoncoreontologies.org/ont00001772,has boolean value,property,OK,"individual i 'has boolean value' individual j iff [individual i 'has boolean value' individual j] and [individual i is an instance of class 'Information Bearing Entity'] , where individual i has a boolean value that is true for individual j."
https://www.commoncoreontologies.org/ont00001773,has integer value,property,OK,"individual i 'has integer value' individual j iff [individual i 'has integer value' individual j] and [individual i is an instance of class 'Information Bearing Entity'] , where individual i has an integer value that is the same as the integer value of individual j."
https://www.commoncoreontologies.org/ont00000003,Designative name,class,OK,"individual i is a 'Designative name' iff individual i is a Designaive 'Information Content Entity' that consists of a string of characters that desigates an 'entity' within a specified cultural or social namespace and which is typically a word or phrase in a 'Natural Language' that has an accepted cultural or social significance, and additionally individual i is designtated by a Designtive Information Content Entity'."
https://www.commoncoreontologies.org/ont00000029,Median point estimate information content entity,class,OK,individual i is a 'Median point estimate information content entity' iff individual i is a 'Point Estimate Information Content Entity' and additionally individual i 'is a measurement of' a set of values and is equal to either the middle value or the average of the two values which separate the set into two equally populated upper and lower sets'.
https://www.commoncoreontologies.org/ont00000067,Civil time reference system,class,OK,individual i is a 'Civil time reference system' iff individual i is a 'Temporal Reference System' and additionally individual i is a statutory time scale 'designated by' civilian authorities to determine local time(s).
https://www.commoncoreontologies.org/ont00000073,Temporal interval identifier,class,OK,"individual i is a 'Temporal interval identifier' iff individual i is a 'Temporal Region Identifier' that 'designates' some 'temporal interval' and additionally individual i is a 'one-dimensional temporal region' that is continuous, thus without gaps or breaks."
https://www.commoncoreontologies.org/ont00000077,Code identifier,class,OK,individual i is a 'Code identifier' iff individual i is a 'Non-Name Identifier' and additionally individual i 'designates' an 'entity' within a specified namespace or context such that metadata can be derived from the identifier.
https://www.commoncoreontologies.org/ont00000080,Standard time of day identifier,class,OK,individual i is a 'Standard time of day identifier' iff individual i is a 'Time of Day Identifier' and additionally individual i has a datetime value'.
https://www.commoncoreontologies.org/ont00000087,Ordinal date identifier,class,OK,individual i is a 'Ordinal date identifier' iff individual i is a 'Decimal Date Identifier' and additionally individual i 'designates' some 'Day' by using a number to indicate the sequential ordering of the 'Day' since the beginning of the Year'.
https://www.commoncoreontologies.org/ont00000120,Measurement unit,class,OK,"individual i is a 'Measurement unit' iff individual i is a 'Descriptive Information Content Entity' that 'describes' a definite magnitude of a physical quantity, defined and adopted by convention and/or by law, and additionally individual i is used as a standard for measurement of the same physical quantity."
https://www.commoncoreontologies.org/ont00000124,Solar time reference system,class,OK,individual i is a 'Solar time reference system' iff individual i is a 'Temporal Reference System' and additionally individual i is based on the position of the Sun in the sky'.
https://www.commoncoreontologies.org/ont00000127,Performance specification,class,OK,individual i is a 'Performance specification' iff individual i is a 'Directive Information Content Entity' and additionally individual i 'prescribes' some aspect of the 'Behavior' of a participant in a 'process' given one or more operating conditions.
https://www.commoncoreontologies.org/ont00000146,Artificial language,class,OK,individual i is a 'Artificial language' iff individual i is a 'Language' and additionally individual i is developed through conscious planning and premeditation.
https://www.commoncoreontologies.org/ont00000154,Mode point estimate information content entity,class,OK,individual i is a 'Mode point estimate information content entity' iff individual i is a 'Point Estimate Information Content Entity' that 'is a measurement of' a set of values and additionally individual i is the value or values that occur most often in the set.
https://www.commoncoreontologies.org/ont00000164,Minimum ordinal measurement information content entity,class,OK,individual i is a 'Minimum ordinal measurement information content entity' iff individual i is an 'Ordinal Measurement Information Content Entity' and additionally individual i 'is a measurement of' some 'entity' in virtue of it being the smallest or having the least 'Amount' relative to a nominally described set of like entities'.
https://www.commoncoreontologies.org/ont00000186,Artifact version ordinality,class,OK,individual i is a 'Artifact version ordinality' iff individual i is a 'Ordinal Measurement Information Content Entity' and additionally individual i 'is about' the form of an Artifact which d
https://www.commoncoreontologies.org/ont00000203,Event status nominal information content entity,class,OK,individual i is a 'Event status nominal information content entity' iff individual i is a 'Nominal Measurement Information Content Entity' and additionally individual i 'is a measurement of' the current state of a 'process'.
https://www.commoncoreontologies.org/ont00000253,Information bearing entity,class,OK,individual i is a 'Information bearing entity' iff individual i is a 'object' upon which an 'Information Content Entity' generally depends and additionally individual i is a 'Information Bearing Artifact' that carries an 'Information Content Entity' and is designed to do so using a particular format or structure.
https://www.commoncoreontologies.org/ont00000263,Clock time system,class,OK,individual i is a 'Clock time system' iff individual i is a 'Temporal Reference System' and additionally individual i 'has temporal part' 'Time of Day'.
https://www.commoncoreontologies.org/ont00000275,Spatial reference system,class,OK,individual i is a 'Spatial reference system' iff individual i is a 'Reference System' and additionally individual i 'describe(s)' a set of standards for uniquely identifying the position of an 'entity' or the direction of a vector within a defined 'spatial region' by means of measurements along one or more Coordinate System Axes.
https://www.commoncoreontologies.org/ont00000276,Solar calendar system,class,OK,individual i is a 'Solar calendar system' iff individual i is a 'Calendar System' and additionally individual i organizes and identifies dates based on the cycles of an astronomical body's orbit around the Sun.
https://www.commoncoreontologies.org/ont00000293,Nominal measurement information content entity,class,OK,"individual i is a 'Nominal measurement information content entity' iff individual i is a 'Measurement Infoirmation Content entity' and additionally individual i 'is a nominal measurement of' some 'entity', where the measurement classifies the 'entity' according to some shared, possibly arbitrary, characteristic."
https://www.commoncoreontologies.org/ont00000314,Information quality entity,class,OK,individual i is a 'Information quality entity' iff individual i is a 'quality' that 'is a measurement of' some 'Information Content Entity' and additionally individual i 'describe(s)' the characteristics by which that 'Information Content Entity' can be recognized or visualized.
https://www.commoncoreontologies.org/ont00000369,Priority measurement information content entity,class,OK,individual i is a 'Priority measurement information content entity' iff individual i is a 'Ordinal Measurement Information Content Entity' and additionally individual i 'is a measurement of' the relative importance of an entity'.
https://www.commoncoreontologies.org/ont00000390,Spatial region identifier,class,OK,individual i is a 'Spatial region identifier' iff individual i is a 'Designaative Information Content Entity' and additionally individual i 'designates' some 'spaatial region'.
https://www.commoncoreontologies.org/ont00000398,Reference system,class,OK,individual i is a 'Reference system' iff individual i is a 'Descriptive Information Content Entity' and additionally individual i 'describes' a set of standards for organizing and understanding data of the specified type or domain.
https://www.commoncoreontologies.org/ont00000399,Temporal region identifier,class,OK,individual i is a 'Temporal region identifier' iff individual i is a Desigative 'Information Content Entity' that 'describes' a 'temporal region' and additionally individual i 'is about' a temporal region'.
https://www.commoncoreontologies.org/ont00000406,Measurement unit of geocoordinate,class,OK,individual i is a 'Measurement unit of geocoordinate' iff individual i is a 'Measurement Unit' and additionally individual i 'has latitude value' and 'has longitude value'.
https://www.commoncoreontologies.org/ont00000419,Part number,class,OK,individual i is a 'Part number' iff individual i is a 'Code Identifier' and additionally individual i 'designates' a type of part whose instances are designed to be part of some Artifact.
