iri,label,type,status,definition
https://www.commoncoreontologies.org/ont00001801,is subject of,property,OK,"individual i is_mention_of j iff individual i is an instance of List and j is an instance of Entity, such that j is mentioned in the context of a sequence of entities."
https://www.commoncoreontologies.org/ont00001808,is about,property,OK,"individual i is_about individual j' iff individual i is an instance of Representational Information Content Entity and individual j is an instance of Entity, such that individual i represents some aspect of individual j."
https://www.commoncoreontologies.org/ont00001811,is an ordinal measurement of,property,OK,"individual i is_an_ordinal_measurement_of individual j' iff individual i is an instance of Measurement Information Content Entity and individual j is an instance of Entity, such that x is a measurement of some attribute of y relative to a scale ordered by rank."
https://www.commoncoreontologies.org/ont00001824,is excerpted from,property,OK,"individual i is excerpted from individual j' iff individual i is part of some Information Bearing Entity B1 that is carrier of some Information Content Entity C1, and individual j is carrier of some Information Content Entity C2, and C1 is not identical with C2, and individual i is carrier of some Information Content Entity c1, and individual j is an Information Bearing Entity that is part of another Information Bearing Entity B2, and B2 is carrier of some Information Content Entity b2, and b2 is carrier of c1 (i."
https://www.commoncoreontologies.org/ont00001837,time zone identifier used by,property,OK,"individual i is in time zone identifier used by j' iff individual i is an instance of Location and j is an instance of Time Zone Identifier, such that j designates the spatial region associated with the time zone mentioned in i."
https://www.commoncoreontologies.org/ont00001863,uses measurement unit,property,OK,"individual i uses_measurement_unit j' iff individual i is an instance of Information Bearing Entity and j is an instance of Measurement Unit, such that j describes the magnitude of measured physical quantity mentioned in i."
https://www.commoncoreontologies.org/ont00001868,is a nominal measurement of,property,OK,"individual i is a Nominal Measurement Information Content Entity that classifies individual j relative to some set of shared, possibly arbitrary, characteristics."
https://www.commoncoreontologies.org/ont00001873,represented by,property,OK,"individual i is_a_nominal_measurement_of individual j' iff individual i is an instance of Nominal Measurement Information Content Entity and individual j is an instance of Entity, such that x classifies y relative to some set of shared, possibly arbitrary, characteristics."
https://www.commoncoreontologies.org/ont00001877,is an interval measurement of,property,OK,"individual i is an instance of Information Content Entity and y is an instance of Entity, such that x describes some attribute of y relative to a scale which has uniform intervals but has a zero value that corresponds to the absence of the attribute being measured, and additionally individual i is an instance of Interval Measurement Information Content Entity and j is an instance of Entity, such that x measures the extent or duration of y."
https://www.commoncoreontologies.org/ont00001878,is mention of,property,OK,"individual i is_mention_of y' iff individual i is an instance of Information Bearing Entity and y is an instance of Entity, such that individual i is used as a reference to y."
https://www.commoncoreontologies.org/ont00001879,designated by,property,OK,"individual i is_designated_by j iff j is an instance of Designative Information Content Entity and i is an instance of Entity, such that given some context, j uniquely distinguishes i from other entities."
https://www.commoncoreontologies.org/ont00001884,condition described by,property,OK,individual i X of individual j' iff individual i Y individual j [ and individual i is instance of class C and individual j is instance of class D] and additionally has the property of Z.
https://www.commoncoreontologies.org/ont00001899,language used in,property,OK,"individual i uses language y to describe entity j' iff individual i is an instance of Agent and y is an instance of Language, such that individual i uses y as a means to communicate about or refer to entity j."
https://www.commoncoreontologies.org/ont00001900,is geospatial coordinate reference system of,property,OK,"individual i is geospatial coordinate reference system of individual j' iff individual i is an instance of Geospatial Coordinate Reference System and individual j is an instance of Information Bearing Entity, such that individual i describes the set of standards mentioned in individual j."
https://www.commoncoreontologies.org/ont00001904,is measured by,property,OK,"individual i is_measured_by_ratio x' iff individual i is an instance of Entity and x is an instance of Measurement Unit, such that x describes the magnitude of measured physical quantity mentioned in individual i relative to a scale which has uniform intervals but has a zero value that does not correspond to an absence of the attribute being measured."
https://www.commoncoreontologies.org/ont00001908,uses time zone identifier,property,OK,"individual i uses_time_zone_identifier y to designate the spatial region associated with the time zone mentioned in individual j, and individual i is instance of Information Bearing Entity."
https://www.commoncoreontologies.org/ont00001912,uses reference system,property,OK,"individual i uses_reference_system x of individual j' iff individual i is an instance of Information Bearing Entity and x is an instance of Reference System, such that x describes the set of standards mentioned in y, and individual j is an instance of Information Content Entity, such that y is about the characteristics by which j can be recognized or visualized."
https://www.commoncoreontologies.org/ont00001913,uses geospatial coordinate reference system,property,OK,"individual i uses geospatial coordinate reference system x' iff individual i is an instance of Information Bearing Entity and x is an instance of Geospatial Coordinate Reference System, such that x describes the set of standards mentioned in individual i."
https://www.commoncoreontologies.org/ont00001914,is measured by nominal,property,OK,individual i X of individual j' iff individual i Y individual j [ and individual i is instance of class C and individual j is instance of class D] and additionally has the property of Z.
https://www.commoncoreontologies.org/ont00001916,designates,property,OK,individual i X of individual j' iff individual i Y individual j [ and individual i is instance of class C and individual j is instance of class D] and additionally has the property of Z.
https://www.commoncoreontologies.org/ont00001917,described by,property,OK,individual i .
https://www.commoncoreontologies.org/ont00001919,is mentioned by,property,OK,"individual i is_mentioned_by individual j' iff individual i is an instance of Entity and individual j is an instance of Information Bearing Entity, such that individual j is used as a reference to individual i."
https://www.commoncoreontologies.org/ont00001920,prescribed by,property,OK,individual i X of individual j' iff individual i Y individual j [ and individual i is instance of class C and individual j is instance of class D] and additionally has the property of Z.
https://www.commoncoreontologies.org/ont00001938,represents,property,OK,"individual i represents y of individual j' iff individual i is an instance of Representational Information Content Entity, and y is an instance of Entity, and z is carrier of x, such that x is about y in virtue of there existing an isomorphism between characteristics of z and y."
https://www.commoncoreontologies.org/ont00001942,prescribes,property,OK,"individual i prescribes y of individual j' iff individual i is an instance of Directive Information Content Entity and y is an instance of Entity, such that x prescribes that some z must occur."
https://www.commoncoreontologies.org/ont00001961,is measurement unit of,property,OK,"individual i is_measurement_unit_of j [ and individual i is instance of Measurement Unit Information Content Entity and j is instance of Measurement Information Content Entity, such that i describes the magnitude of measured physical quantity mentioned in j."
https://www.commoncoreontologies.org/ont00001963,is measured by ordinal,property,OK,individual i X of individual j' iff individual i Y individual j [ and individual i is instance of class C and individual j is instance of class D] and additionally has the property of Z.
https://www.commoncoreontologies.org/ont00001964,is measured by interval,property,OK,"individual i is_measured_by_interval x' iff individual i is an instance of Interval Measurement Information Content Entity and x is an instance of Measurement Information Content Entity, such that x describes some attribute of individual i relative to a scale which has uniform intervals but has a zero value that does not correspond to an absence of the attribute being measured."
https://www.commoncoreontologies.org/ont00001965,is measured by ratio,property,OK,"individual i Y of individual j' iff individual i is instance of Proportional Ratio Measurement Information Content Entity and individual j is instance of Entity, such that x is an instance of Information Content Entity and y is an instance of Entity, such that x describes some attribute of y relative to a scale having equal unit values and a zero value that corresponds to the absence of the attribute being measured, and furthermore, the ratio between the numerator and denominator of x is proportional to the ratio between the corresponding attributes of individual i and j."
https://www.commoncoreontologies.org/ont00001966,is a measurement of,property,OK,"individual i is_a_measurement_of_nominal y and individual j is an instance of Entity, such that x describes some attribute of y relative to a set of shared, possibly arbitrary, characteristics."
https://www.commoncoreontologies.org/ont00001976,uses language,property,OK,individual i uses_language y' iff individual i is an instance of an Information Bearing Entity and y is an instance of a Language such that the literal value of i is a string that is encoded according to the syntax of y.
https://www.commoncoreontologies.org/ont00001980,describes condition,property,OK,individual i X of individual j' iff individual i has_process_part j [ and individual i is instance of a Performance Specification and j is instance of an Event Status Nominal Information Content Entity] and additionally has the property of describes condition.
https://www.commoncoreontologies.org/ont00001982,describes,property,OK,"individual i is_about y' iff individual i is an instance of Information Content Entity, and y is an instance of Entity, such that individual i is about the characteristics that identify y."
https://www.commoncoreontologies.org/ont00001983,is a ratio measurement of,property,OK,"individual i is_a_ratio_measurement_of y"" iff individual i is an instance of Ratio Measurement Information Content Entity and y is an instance of Entity, such that individual i describes some attribute of y relative to a scale having equal unit values and a zero value that corresponds to the absence of the attribute being measured."
https://www.commoncoreontologies.org/ont00001997,is reference system of,property,OK,"individual i is_reference_system_of individual j' iff individual i is an instance of Reference System and individual j is an instance of Information Bearing Entity, such that individual i describes the set of standards mentioned in individual j."
https://www.commoncoreontologies.org/ont00001765,has text value,property,OK,individual i has text value of individual j' iff individual i has data property Y of string value Z [and individual i is instance of class C and individual j is instance of class D].
https://www.commoncoreontologies.org/ont00001767,has datetime value,property,OK,individual i has datetime value' iff individual i has a data property that has as its range a datetime value.
https://www.commoncoreontologies.org/ont00001768,has URI value,property,OK,individual i has URI value of individual j' iff individual i has a data property with range equal to the URI value of individual j and additionally has the property of Y [and is instance of class C or D].
https://www.commoncoreontologies.org/ont00001769,has decimal value,property,NOK,A data property that has as its range a decimal value.
https://www.commoncoreontologies.org/ont00001770,has double value,property,OK,individual i has double value of individual j' iff individual i has a data property that has as its range a double value and individual j is instance of class C or D.
https://www.commoncoreontologies.org/ont00001771,has date value,property,OK,individual i has a data property that has as its range a date value and individual j is instance of class C or D.
https://www.commoncoreontologies.org/ont00001772,has boolean value,property,OK,individual i has boolean value of b at time t' iff individual i has a data property that has as its range a boolean value and the value of that property is b at time t.
https://www.commoncoreontologies.org/ont00001773,has integer value,property,NOK,A data property that has as its range an integer value.
https://www.commoncoreontologies.org/ont00000003,Designative Name,class,OK,"individual i is a Designative Name' iff individual i is a Designative Information Content Entity that consists of a string of characters that designates an entity within a specified cultural or social namespace and which is typically a word or phrase in a natural language that has an accepted cultural or social significance, and additionally, individual i is uniquely distinguishable from other entities by virtue of its designation."
https://www.commoncoreontologies.org/ont00000029,Median Point Estimate Information Content Entity,class,OK,individual i is a Median Point Estimate Information Content Entity' iff individual i is a Point Estimate Information Content Entity and additionally has a measurement that is equal to either the middle value or the average of the two values which separate the set into two equally populated upper and lower sets.
https://www.commoncoreontologies.org/ont00000067,Civil Time Reference System,class,OK,"individual i is a Civil Time Reference System' iff individual i is a Temporal Reference System and additionally uses_geospatial_coordinate_reference_system y, where y is an instance of Geospatial Coordinate Reference System that describes the set of standards for measuring time as well as understanding the context of and organizing temporal data."
https://www.commoncoreontologies.org/ont00000073,Temporal Interval Identifier,class,OK,"individual i is a Temporal Interval Identifier' iff i is a Temporal Region Identifier that designates some Temporal Interval and additionally interval equals (i, some other Temporal Interval Identifier) or interval during (some other Temporal Interval Identifier, i) or interval started by (some other Temporal Interval Identifier, i) or interval contains (i, some other Temporal Interval Identifier) or interval finishes (some other Temporal Interval Identifier, i) or interval is after (some other Temporal Interval Identifier, i) or interval is before (some other Temporal Interval Identifier, i) or interval met by (i, some other Temporal Interval Identifier) or interval started by (i, some other Temporal Interval Identifier) or interval contains (i, some other Temporal Interval Identifier) or interval starts (some other Temporal Interval Identifier, i)."
https://www.commoncoreontologies.org/ont00000077,Code Identifier,class,OK,individual i is a Code Identifier' iff individual i is a Non-Name Identifier that consists of a string of characters that was created and assigned according to an encoding system such that metadata can be derived from the identifier.
https://www.commoncoreontologies.org/ont00000080,Standard Time of Day Identifier,class,OK,"individual i is a Standard Time of Day Identifier' iff individual i is a Time of Day Identifier that designates some Time of Day using the Hours, Minutes, and Seconds of the Day that preceded the Temporal Instant."
https://www.commoncoreontologies.org/ont00000087,Ordinal Date Identifier,class,OK,individual i is a Decimal Date Identifier that designates some Day by using a number to indicate the sequential ordering of the Day since the beginning of the Year.
https://www.commoncoreontologies.org/ont00000120,Measurement Unit,class,OK,"individual i is a Measurement Unit and additionally describes a definite magnitude of a physical quantity, defined and adopted by convention and/or by law, that is used as a standard for measurement of the same physical quantity."
https://www.commoncoreontologies.org/ont00000124,Solar Time Reference System,class,OK,individual i is a Solar Time Reference System' iff individual i is a Temporal Reference System that is based on the position of the Sun in the sky and uses the time zone identifier y to describe the spatial region associated with the time zone mentioned in x.
https://www.commoncoreontologies.org/ont00000127,Performance Specification,class,OK,"individual i is a Performance Specification' iff individual i is a Directive Information Content Entity that prescribes some aspect of the behavior of a participant in a Process given one or more operating conditions, and additionally describes condition c, where c is an entity that is causally relevant to s existing as prescribed by p."
https://www.commoncoreontologies.org/ont00000146,Artificial Language,class,OK,"individual i is an Artificial Language' iff individual i is a Language that is developed through conscious planning and premeditation, rather than one that was developed through use and repetition."
https://www.commoncoreontologies.org/ont00000154,Mode Point Estimate Information Content Entity,class,OK,individual i is a Mode Point Estimate Information Content Entity' iff individual i is a Point Estimate Information Content Entity that is a measurement of a set of values and is equal to the value or values that occur most often in the set.
https://www.commoncoreontologies.org/ont00000164,Minimum Ordinal Measurement Information Content Entity,class,OK,"individual i is an instance of Information Content Entity and has some attribute that is described relative to a nominally described set of like entities, where the attribute is measured by ordinal on an interval scale having no true zero value."
https://www.commoncoreontologies.org/ont00000186,Artifact Version Ordinality,class,OK,individual i is a Artifact Version Ordinality' iff individual i is a An Ordinal Measurement Information Content Entity that is about the form of an Artifact which differs in some respects from previous or future forms of that Artifact.
https://www.commoncoreontologies.org/ont00000203,Event Status Nominal Information Content Entity,class,OK,"individual i is a Nominal Measurement Information Content Entity that is a measurement of the current state of a process' iff individual i is a Y and additionally Z""."
https://www.commoncoreontologies.org/ont00000253,Information Bearing Entity,class,OK,individual i is a Information Bearing Entity' iff individual i is a Information Content Entity Generically Dependent Entity and additionally carries some Information Content Entity.
https://www.commoncoreontologies.org/ont00000263,Clock Time System,class,OK,individual i is a Temporal Reference System' iff individual i is a Clock Time System and additionally it uses time zone identifier.
https://www.commoncoreontologies.org/ont00000275,Spatial Reference System,class,OK,individual i is a Spatial Reference System' iff individual i is an instance of Information Bearing Entity and additionally describes a set of standards for uniquely identifying the position of an entity or the direction of a vector within a defined spatial region by means of measurements along one or more Coordinate System Axes.
https://www.commoncoreontologies.org/ont00000276,Solar Calendar System,class,OK,"individual i is a Solar Calendar System' iff individual i is a Calendar System that is designed to organize and identify dates based on the cycles of an Astronomical Body's Orbit around the Sun, where the differentia Z is described by using time zone identifier or geospatial coordinate reference system."
https://www.commoncoreontologies.org/ont00000293,Nominal Measurement Information Content Entity,class,OK,"individual i is a Nominal Measurement Information Content Entity and additionally it consists of a symbol that classifies Entities according to some shared, possibly arbitrary, characteristic."
https://www.commoncoreontologies.org/ont00000314,Information Quality Entity,class,OK,individual i is a Measurement Information Content Entity and additionally it describes some Entity relative to some scale or classification scheme.
https://www.commoncoreontologies.org/ont00000369,Priority Measurement Information Content Entity,class,OK,individual i is a Priority Measurement Information Content Entity' iff individual i is a Priority Measurement Information Content Entity that is a measurement of the relative importance of an entity.
https://www.commoncoreontologies.org/ont00000390,Spatial Region Identifier,class,OK,individual i is a Spatial Region Identifier' iff individual i is a Designative Information Content Entity that designates some Spatial Region and additionally describes some characteristics of that spatial region.
https://www.commoncoreontologies.org/ont00000398,Reference System,class,OK,"individual i is a Reference System' iff individual i is a Descriptive Information Content Entity that describes a set of standards for organizing and understanding data of the specified type or domain, such as spatial or temporal reference systems."
https://www.commoncoreontologies.org/ont00000399,Temporal Region Identifier,class,OK,"individual i is a Temporal Region Identifier' iff individual i is a Designative Information Content Entity that designates some Temporal Region and additionally describes some temporal aspect of the region, such as its duration or occurrence."
https://www.commoncoreontologies.org/ont00000406,Measurement Unit of Geocoordinate,class,OK,individual i is a Measurement Unit of Geocoordinate' iff individual i is a Measurement Unit specifying the geospatial coordinates of a location and additionally has latitude value and longitude value.
https://www.commoncoreontologies.org/ont00000419,Part Number,class,OK,"individual i is a Part Number' iff individual i is a Code Identifier that designates a type of part whose instances are designed to be part of some Artifact, and additionally it was assigned according to an encoding system such that metadata can be derived from the identifier."
https://www.commoncoreontologies.org/ont00000469,Geospatial Coordinate Reference System,class,OK,"individual i is a Geospatial Coordinate Reference System' iff individual i is a Spatial Reference System that is used to determine and identify the location of a point or object at or near the surface of the Earth, such that x describes the set of standards mentioned in y."
https://www.commoncoreontologies.org/ont00000496,Natural Language,class,OK,individual i is a Natural Language' iff individual i is a Natural Language and additionally uses language to communicate with other individuals.
https://www.commoncoreontologies.org/ont00000529,Date Identifier,class,OK,individual i is a Date Identifier' iff individual i is a Temporal Interval Identifier that designates some Day and additionally has datetime value.
https://www.commoncoreontologies.org/ont00000539,Count Measurement Information Content Entity,class,OK,"individual i is a Proportional Ratio Measurement Information Content Entity"" iff individual i is a Count Measurement Information Content Entity that is a measurement of the number of members of some aggregate and additionally uses measurement unit."
https://www.commoncoreontologies.org/ont00000540,Temporal Instant Identifier,class,OK,individual i is a Temporal Region Identifier that designates some Temporal Instant' iff individual i is a Temporal Interval Identifier that designates some temporal interval and additionally the starting instant of that temporal interval is an instance of a temporal instant.
https://www.commoncoreontologies.org/ont00000589,Julian Date Fraction,class,OK,individual i is a Julian Date Fraction' iff individual i is a Decimal Time of Day Identifier that designates an approximate Temporal Instant that is part of some Julian Day and has a decimal value.
https://www.commoncoreontologies.org/ont00000592,Veracity Measurement Information Content Entity,class,OK,individual i is a Veracity Measurement Information Content Entity' iff individual i is a Measurement Information Content Entity that is a measurement of the extent to which a description conforms to the reality it describes.
https://www.commoncoreontologies.org/ont00000604,Maximum Ordinal Measurement Information Content Entity,class,OK,individual i is a Maximum Ordinal Measurement Information Content Entity' iff individual i is an instance of Information Content Entity and has the greatest amount relative to a nominally described set of like entities.
https://www.commoncoreontologies.org/ont00000605,Abbreviated Name,class,OK,"individual i is a X' iff individual i is a Y and additionally Z, where Y is an abbreviation of a proper name and Z describes the differentia of the class."
