iri,label,type,status,definition
https://www.commoncoreontologies.org/ont00000406,Measurement unit of geocoordinate,class,OK,"x 'Measurement Unit of Geocoordinate' y iff x 'Measurement Unit' y  and 'Measurement Unit of coordinate' specifies geospatial application, while 'Measurement Unit' is general.. such that x specifies geospatial coordinates of a location."
https://www.commoncoreontologies.org/ont00000419,Part number,class,OK,"x 'Part Number' y iff x 'Code Identifier' y  and 'Part Number' denotes a manufacturer-assigned designation, while 'Code Identifier' signifies a system-generated, potentially standardized, alphanumeric label.. such that x 'Part Number' denotes a manufacturer-assigned designation, while y 'Code Identifier' signifies a system-generated, potentially standardized, alphanumeric label."
https://www.commoncoreontologies.org/ont00000469,Geospatial coordinate reference system,class,OK,"x 'Geospatial Coordinate Reference System' y iff x 'Spatial Reference System' y  and 'Geospatial Coordinate Reference System' denotes Earth-based positioning, while 'Spatial Reference System' is a broader term encompassing any coordinate system.. such that x 'Geospatial cooordinate Reference System' denotes Earth-based positioning, while 'Spaatial Reference System' is a broader term encompassing any coordinate system."
https://www.commoncoreontologies.org/ont00000496,Natural language,class,OK,"x 'Natural Language' y iff x 'Language' y  and 'Natural Language' denotes human communication, while 'Language' is a broader linguistic system.. such that x is a human 'Communication System'."
https://www.commoncoreontologies.org/ont00000529,Date identifier,class,OK,"x 'Date Identifier' y iff x 'Temporal Interval Identifier' y  and 'Date Identifier' denotes a specific point in time, while 'Temporal Interval Identifier' denotes a duration.. such that x 'Date Identifier' denotes a specific point in time, while y 'Temporal Interval Identifier' denotes a duration."
https://www.commoncoreontologies.org/ont00000539,Count measurement information content entity,class,OK,"x 'Count Measurement Information Content Entity' y iff x 'Ratio Measurement Information Content Entity' y  and 'Count Measurement Information Content Entity' denotes discrete quantification, while 'Ratio Measurement Information Content Entity' implies proportional quantification.. such that x 'Count Measurement Information Content Entity' denotes discrete quantification, while y 'Ratio Measurement Information Content Entity' implies proportional quantification."
https://www.commoncoreontologies.org/ont00000540,Temporal instant identifier,class,OK,"x 'Temporal Instant Identifier' y iff x 'Temporal Region Identifier' y  and 'Temporal Instant Identifier' denotes a specific point in time, while 'Temporal Region Identifier' denotes a duration or period of time.. such that y 'Temporal Region Identifier' denotes a duration or period of time."
https://www.commoncoreontologies.org/ont00000589,Julian date fraction,class,OK,"x 'Julian Date Fraction' y iff x 'Decimal 'Time of Day' Identifier' y  and 'Julian Date Fraction' denotes a fractional representation of time relative to a fixed epoch, while 'Decimal 'Time of Day' Identifier' signifies a numerical representation of time within a 24-'Hour' period.. such that x 'Julian Date Fraction' is part of some 'Julian Day'."
https://www.commoncoreontologies.org/ont00000592,Veracity measurement information content entity,class,OK,"x 'Veracity Measurement Information Content Entity' y iff x 'Measurement Information Content Entity' y  and 'Veracity Measurement Information Content Entity' implies a focus on truthfulness, while 'Measurement Information Content Entity' is more general.. such that x 'Veracity Measurement Information Content Entity' 'is a measurement of' the extent to which a description conforms to the reality it 'describes'."
https://www.commoncoreontologies.org/ont00000604,Maximum ordinal measurement information content entity,class,OK,"x 'Maximum Ordinal Measurement Information Content Entity' y iff x 'Ordinal Measurement Information Content Entity' y  and 'Maximum Ordinal Measurement Information Content Entity' implies a quantifiable upper limit, while 'Ordinal Measurement Information Content Entity' is a more general descriptor.. such that x has a quantifiable upper limit,"
https://www.commoncoreontologies.org/ont00000605,Abbreviated name,class,OK,"x 'Abbreviated Name' y iff x 'Designative Name' y  and 'Abbreviated Name' denotes a shortened form, while 'Designative Name' indicates a formal identifier.. such that x 'Abbreviated Name' denotes a shortened form, while y 'Designative Name' indicates a formal identifier."
https://www.commoncoreontologies.org/ont00000626,Predictive information content entity,class,OK,"x 'Predictive Information Content Entity' y iff x 'Descriptive Information Content Entity' y  and 'Predictive Information Content Entity' denotes forecasting capability, while 'Descriptive Information Content Entity' denotes summarizing capability.. such that x 'Predictive Information Content Entity' denotes forecasting capability, while y 'Descriptive Information Content Entity' denotes summarizing capability."
https://www.commoncoreontologies.org/ont00000630,Universal time reference system,class,OK,"x 'Universal Time Reference System' y iff x 'Solar Time Reference System' y  and 'Universal Time Reference System' denotes a globally consistent time standard, while 'Solar Time Reference System' is based on the Earth's apparent 'Motion' around the Sun.. such that y 'Solar Time Reference System' is based on the average 'Speed' of the Earth's rotation and 'uses' the prime meridian at 0° longitude as a reference point."
https://www.commoncoreontologies.org/ont00000649,Non-name identifier,class,OK,"x 'Non-Name Identifier' y iff x 'Designative Information Content Entity' y  and 'Non-Name Identifier' denotes an absent name, while 'Designative Information Content Entity' signifies a structured data element.. such that x 'Non-Name Identifier' denotes an absent name, while y 'Designaive Infoirmaation Content entity' signifies a structured data element."
https://www.commoncoreontologies.org/ont00000653,Algorithm,class,OK,"x 'Algorithm' y iff x 'Directive Information Content Entity' y  and 'Algorithm' denotes a computational procedure, while 'Directive Information Content Entity' refers to structured data instructions.. such that x 'Algorithm' y denotes a computational procedure."
https://www.commoncoreontologies.org/ont00000669,Distance measurement information content entity,class,OK,"x 'Distance Measurement Information Content Entity' y iff x 'Ratio Measurement Information Content Entity' y  and 'Distance Measurement Information Content Entity' denotes spatial quantification, while 'Ratio Measurement Information Content Entity' implies proportional quantification.. such that x is a spatial quantification of a One-Dimensional Extent inhering in some 'site' that is externally connected to two Independent Continuants."
https://www.commoncoreontologies.org/ont00000683,Diminutive name,class,OK,"x 'Diminutive Name' y iff x 'Abbreviated Name' y  and 'Diminutive Name' refers to a shortened, often affectionate version, while 'Abbreviated Name' denotes a shortened form typically for brevity or formality.. such that x 'Diminutive Name' is a familiar form of y 'Proper Name'."
https://www.commoncoreontologies.org/ont00000686,Designative information content entity,class,OK,"x 'Designative Information Content Entity' y iff x 'Information Content Entity' y  and 'Designative Information Content Entity' specifies a defined 'entity', while 'Information Content Entity' is a broader category.. such that x specifies a defined 'entity'."
https://www.commoncoreontologies.org/ont00000692,Probability measurement information content entity,class,OK,"x 'Probability Measurement Information Content Entity' y iff x 'Measurement Information Content Entity' y  and 'Probability Measurement Information Content Entity' denotes a probabilistic quantification, while 'Measurement Information Content Entity' implies a more general informational quantification.. such that x 'Probability Measurement Information Content Entity' is a probabilistic quantification of the likelihood that a 'process' or 'process' Aggregate occurs."
https://www.commoncoreontologies.org/ont00000729,Spherical coordinate system,class,OK,"x 'Spherical Coordinate System' y iff x 'Spatial Reference System' y  and 'Spherical Coordinate System' denotes position using angles from a center, while 'Spatial Reference System' defines a coordinate framework for locations on a surface.. such that x 'Spherical cooordinate system' denotes position using angles from a center, while 'Spaatial Reference System' defines a cooordinate framework for locations on a surface."
https://www.commoncoreontologies.org/ont00000731,Deviation measurement information content entity,class,OK,"x 'Deviation Measurement Information Content Entity' y iff x 'Measurement Information Content Entity' y  and 'Deviation Measurement Information Content Entity' implies a focus on deviations, while 'Measurement Information Content Entity' is more general.. such that it focuses on deviations."
https://www.commoncoreontologies.org/ont00000735,Geospatial region bounding box identifier list,class,OK,"x 'Geospatial Region Bounding Box Identifier List' y iff x 'Measurement Unit of Geocoordinate' y  and 'Geospatial Region Bounding Box Identifier List' denotes spatial extent, while 'Measurement Unit of Coordinate' specifies dimensional reference.. such that x 'Geospatial Region Bounding Box Identifier List' is comprised of four pairs of coordinates, one for each of the defining points (North, West, South, East) of a 'Geospatial Region Bounding Box'."
https://www.commoncoreontologies.org/ont00000745,Point estimate information content entity,class,OK,"x 'Point Estimate Information Content Entity' y iff x 'Estimate Information Content Entity' y  and 'Point Estimate Information Content Entity' denotes a specific, singular value, while 'Estimate Information Content Entity' suggests a broader, potentially variable 'entity'.. such that x 'Point Estimate Information Content Entity' is a specific, singular value, while y 'Estimate Infoirmation Content entity' denotes a broader, potentially variable 'entity'."
https://www.commoncoreontologies.org/ont00000749,Julian day number,class,OK,"x 'Julian 'Day' Number' y iff x 'Decimal Date Identifier' y  and 'Julian 'Day' Number' and 'Decimal Date Identifier' represent distinct, albeit related, numerical systems for encoding dates.. such that x 'represents' a sequential ordering of the 'Day' since the 'Julian Date' epoch."
https://www.commoncoreontologies.org/ont00000827,Time of day identifier,class,OK,"x 'Time of 'Day' Identifier' y iff x 'Temporal Instant Identifier' y  and 'Time of 'Day' Identifier' denotes a broad temporal period, while 'Temporal Instant Identifier' specifies a precise point in time.. such that it 'represents' a specific 'Time of Day'."
https://www.commoncoreontologies.org/ont00000829,Time zone identifier,class,OK,"x 'Time Zone Identifier' y iff x 'Spatial Region Identifier' y  and 'Time Zone Identifier' denotes temporal location, while 'Spatial Region Identifier' denotes geographical location.. such that y 'Spaatial Region Identifier' denotes geographical location."
https://www.commoncoreontologies.org/ont00000833,Julian date identifier,class,OK,"x 'Julian Date Identifier' y iff x 'Decimal 'Time of Day' Identifier' y  and 'Julian Date Identifier' refers to a calendar-based time representation, while 'Decimal 'Time of Day' Identifier' denotes a continuous, numerical time measurement.. such that x 'Julian Date Identifier' 'represents' a calendar-based time representation."
https://www.commoncoreontologies.org/ont00000845,Proportional ratio measurement information content entity,class,OK,"x 'Proportional Ratio Measurement Information Content Entity' y iff x 'Ratio Measurement Information Content Entity' y  and 'Proportional Ratio Measurement Information Content Entity' emphasizes proportionality, while 'Ratio Measurement Information Content Entity' is more general.. such that x 'Proportional Ratio Measurement Information Content Entity' 'is a measurement of' a portion of a whole ('described by' the numerator) compared against that whole ('described by' the denominator) where the whole is a nominally described set of like entities."
https://www.commoncoreontologies.org/ont00000853,Descriptive information content entity,class,OK,"x 'Descriptive Information Content Entity' y iff x 'Information Content Entity' y  and 'Descriptive Information Content Entity' denotes detailed attributes, while 'Information Content Entity' implies core informational properties.. such that x is a detailed description of attributes, while y is a core informational property."
https://www.commoncoreontologies.org/ont00000891,Calendar system,class,OK,"x 'Calendar System' y iff x 'Temporal Reference System' y  and 'Calendar System' denotes a human-constructed schedule; 'Temporal Reference System' encompasses broader, potentially natural, time measurement frameworks.. such that x denotes a human-constructed schedule."
https://www.commoncoreontologies.org/ont00000894,Decimal date identifier,class,OK,"x 'Decimal Date Identifier' y iff x 'Date Identifier' y  and 'Decimal Date Identifier' denotes a specific numerical representation of dates, while 'Date Identifier' is a more general term for any date-related indicator.. such that x 'Decimal Date Identifier' is a 'Date Identifier' that 'designates' some 'Day' by using a number to indicate the sequential ordering of the 'Day' since a specified 'Reference Time'."
https://www.commoncoreontologies.org/ont00000896,Mean point estimate information content entity,class,OK,"x 'Mean Point Estimate Information Content Entity' y iff x 'Point Estimate Information Content Entity' y  and 'Mean Point Estimate Information Content Entity' specifies a statistical mean, while 'Point Estimate Information Content Entity' is a more general descriptor.. such that x is equal to the sum of all the values in the set divided by the total number of values in the set."
https://www.commoncoreontologies.org/ont00000915,Acronym,class,OK,"x 'Acronym' y iff x 'Abbreviated Name' y  and 'Acronym' denotes a pronounced word, while 'Abbreviated Name' refers to a shortened written form.. such that x 'Abbbreviated Name' y combines the initial letters of a 'Desigative Name'."
https://www.commoncoreontologies.org/ont00000916,Lunar calendar system,class,OK,"x 'Lunar Calendar System' y iff x 'Calendar System' y  and 'Lunar Calendar System' denotes lunar cycles, while 'Calendar System' is a broader term encompassing various cyclical timekeeping methods.. such that x 'Lunar Calendar System' is a type of y 'Calendar System' designed to organize and identify dates based on the cycles of the Moon's phases."
https://www.commoncoreontologies.org/ont00000923,Arbitrary identifier,class,OK,"x 'Arbitrary Identifier' y iff x 'Non-Name Identifier' y  and 'Arbitrary Identifier' denotes a randomly assigned label, while 'Non-Name Identifier' signifies an identifier lacking inherent meaning.. such that x 'Arbitrary Identifier' is a randomly assigned label and y 'Non-Name Identifier' signifies an identifier lacking inherent meaning."
https://www.commoncoreontologies.org/ont00000958,Information content entity,class,OK,"x 'Information Content Entity' y iff x 'generically dependent continuant' y  and 'Information Content Entity' denotes a 'bearer of' information, while 'generally dependent continuant' signifies an 'entity' whose properties depend on other entities.. such that x stands in a relation of abountness to some 'entity'."
https://www.commoncoreontologies.org/ont00000965,Prescriptive information content entity,class,OK,"x 'Prescriptive Information Content Entity' y iff, such that x 'Information Content Entity' y consists of a set of propositions or images (as in the case of a blueprint) that prescribe some 'entity'."
https://www.commoncoreontologies.org/ont00000973,Decimal time of day identifier,class,OK,"x 'Decimal 'Time of Day' Identifier' y iff x 'Time of 'Day' Identifier' y  and 'Decimal 'Time of Day' Identifier' denotes a precise, numerical representation of time, while 'Time of 'Day' Identifier' refers to a more general categorization.. such that x 'Decimal 'Time of Day' Identifier' is a 'Time of 'Day' Identifier' that 'designates' an approximate 'temporal instant' that is part of some 'Day' and is specified using a decimal value for the portion of the 'Day' that preceded the 'temporal instant'."
https://www.commoncoreontologies.org/ont00000990,Nickname,class,OK,"x 'Nickname' y iff x 'Designative Name' y  and 'Nickname' denotes a familiar appellation, while 'Designative Name' implies an official or formal identifier.. such that x 'Nickname' denotes a familiar appellation, while y 'Designaive Name' implies an official or formal identifier."
https://www.commoncoreontologies.org/ont00001010,Ordinal measurement information content entity,class,OK,"x 'Ordinal Measurement Information Content Entity' y iff x 'Measurement Information Content Entity' y  and 'Ordinal Measurement Information Content Entity' denotes ranked measurements, while 'Measurement Information Content Entity' refers to general measurement data.. such that x 'Ordinal Measurement Information Content Entity' denotes ranked measurements, while y 'Measurement Infoirmation Content entity' refers to general measurement data."
https://www.commoncoreontologies.org/ont00001014,Proper name,class,OK,"x 'Proper Name' y iff x 'Designative Name' y  and 'Proper Name' denotes a specific individual, while 'Designative Name' identifies a category.. such that x 'Proper Name' denotes a specific individual, while y 'Designaive Name' identifies a category."
https://www.commoncoreontologies.org/ont00001022,Ratio measurement information content entity,class,OK,"x 'Ratio Measurement Information Content Entity' y iff x 'Measurement Information Content Entity' y  and 'Ratio Measurement Information Content Entity' denotes a specific type of 'entity', while 'Measurement Information Content Entity' is a more general descriptor.. such that x 'Ratio Measurement Information Content Entity' is a specific type of 'Measurement Infoirmation Content entity' that consists of a symbol that places a 'quality' of an 'entity' onto an interval scale having a true zero value."
https://www.commoncoreontologies.org/ont00001041,Sequence position ordinality,class,OK,"x 'Sequence Position Ordinality' y iff x 'Ordinal Measurement Information Content Entity' y  and 'Sequence Position Ordinality' denotes positional order, while 'Ordinal Measurement Information Content Entity' specifies data related to ranked measurements.. such that x 'Sequence Position Ordinality' denotes positional order."
https://www.commoncoreontologies.org/ont00001069,Representational information content entity,class,OK,"x 'Representational Information Content Entity' y iff x 'Information Content Entity' y  and 'Representational Information Content Entity' denotes encoded meaning, while 'Information Content Entity' refers to inherent information quantity.. such that x is a 'Representational Information Content Entity' and y is a 'Infoрмаtion Content entity'."
https://www.commoncoreontologies.org/ont00001101,Interval estimate information content entity,class,OK,"x 'Interval Estimate Information Content Entity' y iff x 'Estimate Information Content Entity' y  and 'Interval Estimate Information Content Entity' denotes a probabilistic range, while 'Estimate Information Content Entity' implies a singular, point-estimate 'entity'.. such that x 'Interval Estimate Information Content Entity' denotes a probabilistic range of possible values for the measured 'entity', while y 'Estimate Infoirmation Content entity' implies a singular, point-estimate 'entity'."
https://www.commoncoreontologies.org/ont00001146,Sidereal time reference system,class,OK,"x 'Sidereal Time Reference System' y iff x 'Temporal Reference System' y  and 'Sidereal Time Reference System' denotes asynchronous temporal data, while 'Temporal Reference System' implies synchronous temporal data.. such that x 'Sidereal Time Reference System' denotes asynchronous temporal data based on Earth's rate of rotation relative to fixed stars, rather than the Sun."
https://www.commoncoreontologies.org/ont00001149,Data range interval estimate information content entity,class,OK,"x 'Data Range Interval Estimate Information Content Entity' y iff x 'Interval Estimate Information Content Entity' y  and 'Data Range Interval Estimate Information Content Entity' specifies data as input, while 'Interval Estimate Information Content Entity' is more general.. such that x 'represents' the absolute difference between the largest and smallest values in the set."
https://www.commoncoreontologies.org/ont00001163,Measurement information content entity,class,OK,"x 'Measurement Information Content Entity' y iff x 'Descriptive Information Content Entity' y  and 'Measurement Information Content Entity' denotes quantifiable data, while 'Descriptive Information Content Entity' denotes qualitative data.. such that x 'Measurement Information Content Entity' denotes quantifiable data and y 'Descriptive Information Content Entity' denotes qualitative data."
https://www.commoncoreontologies.org/ont00001175,Language,class,OK,"x 'Language' y iff x 'Directive Information Content Entity' y  and 'Language' denotes a system of communication, while 'Directive Information Content Entity' refers to structured data.. such that x 'Language' denotes a system of communication and y 'Directive Infoirmation Content entity' 'represents' structured data."
https://www.commoncoreontologies.org/ont00001176,Estimate information content entity,class,OK,"x 'Estimate Information Content Entity' y iff x 'Measurement Information Content Entity' y  and 'Estimate Information Content Entity' refers to a projected value, while 'Measurement Information Content Entity' denotes a quantified value.. such that x 'Estimate Information Content Entity' is a projected value of an 'entity' based on partial information about that 'entity' or an appropriately similar 'entity'."
https://www.commoncoreontologies.org/ont00001205,Priority scale,class,OK,"x 'Priority Scale' y iff x 'Reference System' y  and 'Priority Scale' denotes importance ranking, while 'Reference System' indicates a standardized framework.. such that x is designed to rank or identify the importance of entities of the specified type."
https://www.commoncoreontologies.org/ont00001235,Military time zone identifier,class,OK,"x 'Military Time Zone Identifier' y iff x 'Time Zone Identifier' y  and 'Military Time Zone Identifier' denotes a specific, standardized time representation, while 'Time Zone Identifier' is a broader term for any indicator of a geographical time zone.. such that the offset has no variation from Coordinated Universal Time."
https://www.commoncoreontologies.org/ont00001238,Initialism,class,OK,"x 'Initialism' y iff x 'Abbreviated Name' y  and 'Initialism' denotes an 'Acronym', while 'Abbreviated Name' refers to any shortened form.. such that x 'Abbbreviated Name' y consists of the initial letters of some words or syllables in an y 'Desigative Name', and in which each letter is pronounced separately."
https://www.commoncoreontologies.org/ont00001256,Reliability measurement information content entity,class,OK,"x 'Reliability Measurement Information Content Entity' y iff x 'Measurement Information Content Entity' y  and 'Reliability Measurement Information Content Entity' implies a focus on trustworthiness, while 'Measurement Information Content Entity' is more general.. such that x 'Reliability Measurement Information Content Entity' 'is a measurement of' the extent to which an 'entity' can consistently produce an outcome, and y 'Measurement Infoirmation Content entity' is a more general concept."
https://www.commoncoreontologies.org/ont00001309,Lot number,class,OK,"x 'Lot Number' y iff x 'Code Identifier' y  and 'Lot Number' denotes a production batch, while 'Code Identifier' signifies a unique product designation.. such that y 'Code Identifier' signifies a unique product designation."
https://www.commoncoreontologies.org/ont00001328,Temporal reference system,class,OK,"x 'Temporal Reference System' y iff x 'Reference System' y  and 'Temporal Reference System' denotes time-based orientation, while 'Reference System' is a broader term encompassing any coordinate framework.. such that x 'Temporal Reference System' y denotes a set of standards for measuring time and understanding the context of and organizing temporal data."
https://www.commoncoreontologies.org/ont00001331,Legal name,class,OK,"x 'Legal Name' y iff x 'Proper Name' y  and 'Legal Name' denotes the name officially registered with legal authorities, while 'Proper Name' refers to a specific, distinct name.. such that x 'Legal Name' is a 'Proper Name' that is an official name for the designated 'entity' as determined by a 'Government' or court of law."
https://www.commoncoreontologies.org/ont00001340,Calendar date identifier,class,OK,"x 'Calendar Date Identifier' y iff x 'Date Identifier' y  and 'Calendar Date Identifier' denotes a specific date, while 'Date Identifier' is a more general term for any date indicator.. such that x 'Calendar Date Identifier' is a 'Date Identifier' that 'designates' some 'Day' by using a combination of 'Day', 'Week', 'Month', or 'Year' Identifiers formatted according to an implementation of a 'Calendar System'."
